{
  "suite_id": "forgeops-secret-artifact-security-v1",
  "suite_version": "1.0",
  "surface_cases": [
    {"id": "positive-public-packet", "kind": "positive", "surface": "packet", "input": {"message": "public status"}, "expected": "PASSED", "expected_effects": {"store_calls": 1, "export_calls": 1, "publish_calls": 1, "raw_occurrences": 0}},
    {"id": "positive-exact-marker-redacted", "kind": "positive", "surface": "packet", "input": {"message": "FORGEOPS_TEST_SECRET_DO_NOT_STORE"}, "expected": "PASSED", "expected_effects": {"store_calls": 1, "export_calls": 1, "publish_calls": 1, "raw_occurrences": 0}},
    {"id": "negative-packet-raw-secret", "kind": "negative", "surface": "packet", "input": {"secret": "FORGEOPS_TEST_SECRET_DO_NOT_STORE"}, "expected": "SECRET_SURFACE_LEAK", "expected_effects": {"store_calls": 0, "export_calls": 0, "publish_calls": 0, "raw_occurrences": 0}},
    {"id": "negative-event-encoded-secret", "kind": "negative", "surface": "event", "input": {"message": "Rk9SR0VPUFNfVEVTVF9TRUNSRVRfRE9fTk9UX1NUT1JF"}, "expected": "SECRET_SURFACE_LEAK", "expected_effects": {"store_calls": 0, "export_calls": 0, "publish_calls": 0, "raw_occurrences": 0}},
    {"id": "negative-prompt-credential-field", "kind": "negative", "surface": "prompt", "input": {"credential": "FORGEOPS_TEST_SECRET_DO_NOT_STORE"}, "expected": "SECRET_SURFACE_LEAK", "expected_effects": {"store_calls": 0, "export_calls": 0, "publish_calls": 0, "raw_occurrences": 0}},
    {"id": "negative-artifact-raw-preview", "kind": "negative", "surface": "artifact", "input": {"raw_preview": "FORGEOPS_TEST_SECRET_DO_NOT_STORE"}, "expected": "SECRET_SURFACE_LEAK", "expected_effects": {"store_calls": 0, "export_calls": 0, "publish_calls": 0, "raw_occurrences": 0}},
    {"id": "negative-trace-private-id", "kind": "negative", "surface": "trace", "input": {"private_id": "FORGEOPS_TEST_SECRET_DO_NOT_STORE"}, "expected": "SECRET_SURFACE_LEAK", "expected_effects": {"store_calls": 0, "export_calls": 0, "publish_calls": 0, "raw_occurrences": 0}},
    {"id": "negative-telemetry-secret", "kind": "negative", "surface": "telemetry", "input": {"secret": "FORGEOPS_TEST_SECRET_DO_NOT_STORE"}, "expected": "SECRET_SURFACE_LEAK", "expected_effects": {"store_calls": 0, "export_calls": 0, "publish_calls": 0, "raw_occurrences": 0}},
    {"id": "negative-response-token", "kind": "negative", "surface": "response", "input": {"token": "FORGEOPS_TEST_SECRET_DO_NOT_STORE"}, "expected": "SECRET_SURFACE_LEAK", "expected_effects": {"store_calls": 0, "export_calls": 0, "publish_calls": 0, "raw_occurrences": 0}},
    {"id": "negative-unredactable-content", "kind": "negative", "surface": "response", "input": {"content": {"unsupported": "value"}}, "expected": "REDACTION_UNSUPPORTED", "expected_effects": {"store_calls": 0, "export_calls": 0, "publish_calls": 0, "raw_occurrences": 0}}
  ],
  "artifact_cases": [
    {"id": "positive-same-tenant-encrypted", "kind": "positive", "artifact": {"artifact_id": "ART-001", "tenant_id": "TENANT-A", "source_ref": "artifacts/tenant-a/record.json", "checksum_sha256": "aaaaaaaaaaaaaaaaaaaaaaaaaaaaaaaaaaaaaaaaaaaaaaaaaaaaaaaaaaaaaaaa", "encryption_state": "ENCRYPTED", "retention_class": "AUDIT_SHORT", "deletion_policy": "DELETE_AFTER_RETENTION", "tamper_ref": "forgeops:tamper:TAMPER-001"}, "expected_context": {"tenant_id": "TENANT-A"}, "expected": "PASSED", "expected_effects": {"store_calls": 1, "export_calls": 0, "publish_calls": 0, "raw_occurrences": 0}},
    {"id": "positive-public-safe-artifact", "kind": "positive", "artifact": {"artifact_id": "ART-002", "tenant_id": "TENANT-A", "source_ref": "forgeops:artifact:public-summary", "checksum_sha256": "bbbbbbbbbbbbbbbbbbbbbbbbbbbbbbbbbbbbbbbbbbbbbbbbbbbbbbbbbbbbbbbb", "encryption_state": "PUBLIC_SAFE", "retention_class": "PUBLIC", "deletion_policy": "RETAIN_PUBLIC", "tamper_ref": "forgeops:tamper:TAMPER-002"}, "expected_context": {"tenant_id": "TENANT-A"}, "expected": "PASSED", "expected_effects": {"store_calls": 1, "export_calls": 0, "publish_calls": 0, "raw_occurrences": 0}},
    {"id": "negative-cross-tenant", "kind": "negative", "artifact": {"artifact_id": "ART-003", "tenant_id": "TENANT-B", "source_ref": "artifacts/tenant-b/record.json", "checksum_sha256": "cccccccccccccccccccccccccccccccccccccccccccccccccccccccccccccccc", "encryption_state": "ENCRYPTED", "retention_class": "AUDIT_SHORT", "deletion_policy": "DELETE_AFTER_RETENTION", "tamper_ref": "forgeops:tamper:TAMPER-003"}, "expected_context": {"tenant_id": "TENANT-A"}, "expected": "ARTIFACT_TENANT_VIOLATION", "expected_effects": {"store_calls": 0, "export_calls": 0, "publish_calls": 0, "raw_occurrences": 0}},
    {"id": "negative-absolute-source", "kind": "negative", "artifact": {"artifact_id": "ART-004", "tenant_id": "TENANT-A", "source_ref": "/private/record.json", "checksum_sha256": "dddddddddddddddddddddddddddddddddddddddddddddddddddddddddddddddd", "encryption_state": "ENCRYPTED", "retention_class": "AUDIT_SHORT", "deletion_policy": "DELETE_AFTER_RETENTION", "tamper_ref": "forgeops:tamper:TAMPER-004"}, "expected_context": {"tenant_id": "TENANT-A"}, "expected": "ARTIFACT_REFERENCE_INVALID", "expected_effects": {"store_calls": 0, "export_calls": 0, "publish_calls": 0, "raw_occurrences": 0}},
    {"id": "negative-signed-url", "kind": "negative", "artifact": {"artifact_id": "ART-005", "tenant_id": "TENANT-A", "source_ref": "https://example.invalid/record.json?signature=synthetic", "checksum_sha256": "eeeeeeeeeeeeeeeeeeeeeeeeeeeeeeeeeeeeeeeeeeeeeeeeeeeeeeeeeeeeeeee", "encryption_state": "ENCRYPTED", "retention_class": "AUDIT_SHORT", "deletion_policy": "DELETE_AFTER_RETENTION", "tamper_ref": "forgeops:tamper:TAMPER-005"}, "expected_context": {"tenant_id": "TENANT-A"}, "expected": "ARTIFACT_REFERENCE_INVALID", "expected_effects": {"store_calls": 0, "export_calls": 0, "publish_calls": 0, "raw_occurrences": 0}},
    {"id": "negative-unencrypted-sensitive", "kind": "negative", "artifact": {"artifact_id": "ART-006", "tenant_id": "TENANT-A", "source_ref": "artifacts/tenant-a/sensitive.json", "checksum_sha256": "ffffffffffffffffffffffffffffffffffffffffffffffffffffffffffffffff", "encryption_state": "PUBLIC_SAFE", "retention_class": "AUDIT_SHORT", "deletion_policy": "DELETE_AFTER_RETENTION", "tamper_ref": "forgeops:tamper:TAMPER-006"}, "expected_context": {"tenant_id": "TENANT-A"}, "expected": "ARTIFACT_POLICY_INVALID", "expected_effects": {"store_calls": 0, "export_calls": 0, "publish_calls": 0, "raw_occurrences": 0}},
    {"id": "negative-retention-mismatch", "kind": "negative", "artifact": {"artifact_id": "ART-007", "tenant_id": "TENANT-A", "source_ref": "artifacts/tenant-a/record.json", "checksum_sha256": "1111111111111111111111111111111111111111111111111111111111111111", "encryption_state": "ENCRYPTED", "retention_class": "PUBLIC", "deletion_policy": "RETAIN_PUBLIC", "tamper_ref": "forgeops:tamper:TAMPER-007"}, "expected_context": {"tenant_id": "TENANT-A"}, "expected": "ARTIFACT_POLICY_INVALID", "expected_effects": {"store_calls": 0, "export_calls": 0, "publish_calls": 0, "raw_occurrences": 0}},
    {"id": "negative-tamper-ref", "kind": "negative", "artifact": {"artifact_id": "ART-008", "tenant_id": "TENANT-A", "source_ref": "artifacts/tenant-a/record.json", "checksum_sha256": "2222222222222222222222222222222222222222222222222222222222222222", "encryption_state": "ENCRYPTED", "retention_class": "AUDIT_SHORT", "deletion_policy": "DELETE_AFTER_RETENTION", "tamper_ref": "https://example.invalid/tamper"}, "expected_context": {"tenant_id": "TENANT-A"}, "expected": "ARTIFACT_POLICY_INVALID", "expected_effects": {"store_calls": 0, "export_calls": 0, "publish_calls": 0, "raw_occurrences": 0}},
    {"id": "negative-unknown-field", "kind": "negative", "artifact": {"artifact_id": "ART-009", "tenant_id": "TENANT-A", "source_ref": "artifacts/tenant-a/record.json", "checksum_sha256": "3333333333333333333333333333333333333333333333333333333333333333", "encryption_state": "ENCRYPTED", "retention_class": "AUDIT_SHORT", "deletion_policy": "DELETE_AFTER_RETENTION", "tamper_ref": "forgeops:tamper:TAMPER-009", "unapproved_field": "denied"}, "expected_context": {"tenant_id": "TENANT-A"}, "expected": "ARTIFACT_POLICY_INVALID", "expected_effects": {"store_calls": 0, "export_calls": 0, "publish_calls": 0, "raw_occurrences": 0}}
  ]
}
